{
  "schema_version": 1,
  "artifact_type": "extracted_drawing_semantics",
  "status": "partial",
  "decision": "advisory",
  "methods": [
    "svg_text_scan",
    "svg_title_block_material_pair",
    "svg_view_group_metadata",
    "layout_report_views",
    "dimension_map_reference",
    "traceability_reference"
  ],
  "sources": [
    {
      "artifact_type": "svg",
      "path": "docs/examples/motor-mount/drawing/cnc_motor_mount_bracket_drawing.svg",
      "inspected": true,
      "method": "svg_text_scan"
    },
    {
      "artifact_type": "svg",
      "path": "docs/examples/motor-mount/drawing/cnc_motor_mount_bracket_drawing.svg",
      "inspected": true,
      "method": "svg_title_block_material_pair"
    },
    {
      "artifact_type": "svg",
      "path": "docs/examples/motor-mount/drawing/cnc_motor_mount_bracket_drawing.svg",
      "inspected": true,
      "method": "svg_view_group_metadata"
    },
    {
      "artifact_type": "layout_report",
      "path": "docs/examples/motor-mount/drawing/cnc_motor_mount_bracket_layout_report.json",
      "inspected": true,
      "method": "layout_report_views"
    },
    {
      "artifact_type": "dimension_map",
      "path": "docs/examples/motor-mount/drawing/cnc_motor_mount_bracket_dimension_map.json",
      "inspected": true,
      "method": "dimension_map_reference"
    },
    {
      "artifact_type": "traceability",
      "path": "docs/examples/motor-mount/drawing/cnc_motor_mount_bracket_traceability.json",
      "inspected": true,
      "method": "traceability_reference"
    }
  ],
  "views": [
    {
      "id": "front",
      "label": "FRONT",
      "raw_text": "FRONT",
      "view_kind": "orthographic",
      "identity": null,
      "source_view": null,
      "source": "docs/examples/motor-mount/drawing/cnc_motor_mount_bracket_drawing.svg",
      "matched_intent_id": "front",
      "confidence": 0.94,
      "provenance": {
        "artifact_type": "svg",
        "path": "docs/examples/motor-mount/drawing/cnc_motor_mount_bracket_drawing.svg",
        "method": "svg_view_group_metadata",
        "svg_group_id": "drawing-view-front",
        "svg_region_ref": "drawing-view-front"
      }
    },
    {
      "id": "top",
      "label": "TOP",
      "raw_text": "TOP",
      "view_kind": "orthographic",
      "identity": null,
      "source_view": null,
      "source": "docs/examples/motor-mount/drawing/cnc_motor_mount_bracket_drawing.svg",
      "matched_intent_id": "top",
      "confidence": 0.94,
      "provenance": {
        "artifact_type": "svg",
        "path": "docs/examples/motor-mount/drawing/cnc_motor_mount_bracket_drawing.svg",
        "method": "svg_view_group_metadata",
        "svg_group_id": "drawing-view-top",
        "svg_region_ref": "drawing-view-top"
      }
    },
    {
      "id": "right",
      "label": "RIGHT",
      "raw_text": "RIGHT",
      "view_kind": "orthographic",
      "identity": null,
      "source_view": null,
      "source": "docs/examples/motor-mount/drawing/cnc_motor_mount_bracket_drawing.svg",
      "matched_intent_id": "right",
      "confidence": 0.94,
      "provenance": {
        "artifact_type": "svg",
        "path": "docs/examples/motor-mount/drawing/cnc_motor_mount_bracket_drawing.svg",
        "method": "svg_view_group_metadata",
        "svg_group_id": "drawing-view-right",
        "svg_region_ref": "drawing-view-right"
      }
    },
    {
      "id": "iso",
      "label": "ISOMETRIC",
      "raw_text": "ISOMETRIC",
      "view_kind": "isometric",
      "identity": null,
      "source_view": null,
      "source": "docs/examples/motor-mount/drawing/cnc_motor_mount_bracket_drawing.svg",
      "matched_intent_id": "iso",
      "confidence": 0.94,
      "provenance": {
        "artifact_type": "svg",
        "path": "docs/examples/motor-mount/drawing/cnc_motor_mount_bracket_drawing.svg",
        "method": "svg_view_group_metadata",
        "svg_group_id": "drawing-view-iso",
        "svg_region_ref": "drawing-view-iso"
      }
    },
    {
      "id": "front",
      "label": "front",
      "raw_text": "front",
      "view_kind": "orthographic",
      "identity": null,
      "source_view": null,
      "source": "docs/examples/motor-mount/drawing/cnc_motor_mount_bracket_layout_report.json",
      "matched_intent_id": "front",
      "confidence": 0.92,
      "provenance": {
        "artifact_type": "layout_report",
        "path": "docs/examples/motor-mount/drawing/cnc_motor_mount_bracket_layout_report.json",
        "method": "layout_report_views",
        "layout_view_key": "front",
        "layout_region_ref": "views.front"
      }
    },
    {
      "id": "top",
      "label": "top",
      "raw_text": "top",
      "view_kind": "orthographic",
      "identity": null,
      "source_view": null,
      "source": "docs/examples/motor-mount/drawing/cnc_motor_mount_bracket_layout_report.json",
      "matched_intent_id": "top",
      "confidence": 0.92,
      "provenance": {
        "artifact_type": "layout_report",
        "path": "docs/examples/motor-mount/drawing/cnc_motor_mount_bracket_layout_report.json",
        "method": "layout_report_views",
        "layout_view_key": "top",
        "layout_region_ref": "views.top"
      }
    },
    {
      "id": "right",
      "label": "right",
      "raw_text": "right",
      "view_kind": "orthographic",
      "identity": null,
      "source_view": null,
      "source": "docs/examples/motor-mount/drawing/cnc_motor_mount_bracket_layout_report.json",
      "matched_intent_id": "right",
      "confidence": 0.92,
      "provenance": {
        "artifact_type": "layout_report",
        "path": "docs/examples/motor-mount/drawing/cnc_motor_mount_bracket_layout_report.json",
        "method": "layout_report_views",
        "layout_view_key": "right",
        "layout_region_ref": "views.right"
      }
    },
    {
      "id": "iso",
      "label": "iso",
      "raw_text": "iso",
      "view_kind": "isometric",
      "identity": null,
      "source_view": null,
      "source": "docs/examples/motor-mount/drawing/cnc_motor_mount_bracket_layout_report.json",
      "matched_intent_id": "iso",
      "confidence": 0.92,
      "provenance": {
        "artifact_type": "layout_report",
        "path": "docs/examples/motor-mount/drawing/cnc_motor_mount_bracket_layout_report.json",
        "method": "layout_report_views",
        "layout_view_key": "iso",
        "layout_region_ref": "views.iso"
      }
    },
    {
      "id": "front",
      "label": "FRONT",
      "raw_text": "FRONT",
      "view_kind": "orthographic",
      "identity": null,
      "source_view": null,
      "source": "docs/examples/motor-mount/drawing/cnc_motor_mount_bracket_drawing.svg",
      "matched_intent_id": "front",
      "confidence": 0.72,
      "provenance": {
        "artifact_type": "svg",
        "path": "docs/examples/motor-mount/drawing/cnc_motor_mount_bracket_drawing.svg",
        "method": "svg_view_label_scan",
        "svg_text_id": "svg_text_001"
      }
    },
    {
      "id": "top",
      "label": "TOP",
      "raw_text": "TOP",
      "view_kind": "orthographic",
      "identity": null,
      "source_view": null,
      "source": "docs/examples/motor-mount/drawing/cnc_motor_mount_bracket_drawing.svg",
      "matched_intent_id": "top",
      "confidence": 0.72,
      "provenance": {
        "artifact_type": "svg",
        "path": "docs/examples/motor-mount/drawing/cnc_motor_mount_bracket_drawing.svg",
        "method": "svg_view_label_scan",
        "svg_text_id": "svg_text_013"
      }
    },
    {
      "id": "right",
      "label": "RIGHT",
      "raw_text": "RIGHT",
      "view_kind": "orthographic",
      "identity": null,
      "source_view": null,
      "source": "docs/examples/motor-mount/drawing/cnc_motor_mount_bracket_drawing.svg",
      "matched_intent_id": "right",
      "confidence": 0.72,
      "provenance": {
        "artifact_type": "svg",
        "path": "docs/examples/motor-mount/drawing/cnc_motor_mount_bracket_drawing.svg",
        "method": "svg_view_label_scan",
        "svg_text_id": "svg_text_028"
      }
    },
    {
      "id": "iso",
      "label": "ISO",
      "raw_text": "ISO",
      "view_kind": "isometric",
      "identity": null,
      "source_view": null,
      "source": "docs/examples/motor-mount/drawing/cnc_motor_mount_bracket_drawing.svg",
      "matched_intent_id": "iso",
      "confidence": 0.72,
      "provenance": {
        "artifact_type": "svg",
        "path": "docs/examples/motor-mount/drawing/cnc_motor_mount_bracket_drawing.svg",
        "method": "svg_view_label_scan",
        "svg_text_id": "svg_text_033"
      }
    }
  ],
  "dimensions": [
    {
      "id": "svg_text_002",
      "raw_text": "120",
      "value": 120,
      "unit": "mm",
      "matched_intent_id": "BASE_LENGTH",
      "matched_feature_id": "base_plate",
      "source": "docs/examples/motor-mount/drawing/cnc_motor_mount_bracket_drawing.svg",
      "confidence": 0.84,
      "provenance": {
        "artifact_type": "svg",
        "path": "docs/examples/motor-mount/drawing/cnc_motor_mount_bracket_drawing.svg",
        "method": "svg_dimension_text_scan",
        "svg_text_id": "svg_text_002"
      }
    },
    {
      "id": "svg_text_003",
      "raw_text": "68",
      "value": 68,
      "unit": "mm",
      "matched_intent_id": null,
      "matched_feature_id": null,
      "source": "docs/examples/motor-mount/drawing/cnc_motor_mount_bracket_drawing.svg",
      "confidence": 0.62,
      "provenance": {
        "artifact_type": "svg",
        "path": "docs/examples/motor-mount/drawing/cnc_motor_mount_bracket_drawing.svg",
        "method": "svg_dimension_text_scan",
        "svg_text_id": "svg_text_003"
      }
    },
    {
      "id": "svg_text_004",
      "raw_text": "10",
      "value": 10,
      "unit": "mm",
      "matched_intent_id": "BASE_THICKNESS",
      "matched_feature_id": "base_plate",
      "source": "docs/examples/motor-mount/drawing/cnc_motor_mount_bracket_drawing.svg",